[
  {
    "slug": "nl",
    "name": "Nederland",
    "type": "land",
    "level": "rijk",
    "country": "nederland",
    "parent": null,
    "description": null,
    "sources": [
      {
        "source": "src:grondwet",
        "retrieved": "2026-09-17",
        "confidence": "high"
      }
    ]
  },
  {
    "slug": "nl-rijk",
    "name": "Rijk",
    "type": "scope",
    "level": "rijk",
    "country": "nederland",
    "parent": "nl",
    "description": null,
    "sources": [
      {
        "source": "src:grondwet",
        "retrieved": "2026-09-17",
        "confidence": "high"
      }
    ]
  }
]
